"","Code","infos"
"95","GE37","GESTION DE PROJET / Gestion Projet Delai Coa<U+00BB>t Tache Coordination Pilotage Decision Planning Budget / Cette UV d'initiation à la gestion des projets permet aux etudiants d'acquerir le vocabulaire, les concepts et les outils necessaires à la gestion des projets. / Outils et methodes de l'ingenieur / Techniques manageriales / M'aitriser les techniques specifiques de gestion de projet en mettant en oeuvre les fondamentaux de la gestion de projet incluant les phases d'avant-projet (faisabilite, initiation), definition (planification, organisation, budget) et de realisation (mise en oeuvre, controle et cloture). / - preparer les decisions de lancement ou d'arret des projets : realisation de business plan, d'etude de faisabilite technico-economique, etude de rentabilite, cahier des charges preliminaire; - clarifier les missions, les objectifs, les contrats; - organiser le projet : preparer les plannings, les budgets, choisir son equipe et repartir les taches, m'aitriser les delais et les coa<U+00BB>ts, anticiper le risque; - piloter l'action, gerer l'information, motiver et mener l'equipe au succes; - capitaliser l'experience acquise et organiser le retour d'experience. / - travailler de maniere collaborative / ·Definitions et enjeux. Methode generale de gestion de projet. Processus generiques : coa<U+00BB>ts, delais, performances, ressources, achats, risques. Phases du projet, jalons, acteurs du projet (MOA /MOE). ·Le referentiel de gestion : Note de clarification, structuration du projet (PBS, WBS, OBS), notion de tache, planification et elaboration du budget de reference. Introduction du guide interactif multimedia d'aide a<U+00A0> la gestion de projet « PACK ASSO » en vue de la formation a<U+00A0> distance. ·La phase d'avant-projet : Methode de gestion en phase d'avant-projet. Dossier d'avant projet : Faisabilite technique et economique d'un projet. Cahier des Charges sommaire.Analyse preliminaire des risques. ·La phase de definition : La constitution de l'equipe projet, la definition des roles. Analyse preliminaire des risques. ·La phase de realisation : piloter le projet. Les differents niveaux de pilotage et de gestion. Le suivi operationnel : Le controle de l'avancement, la gestion du temps, la m'aitrise des coa<U+00BB>ts. Du suivi au pilotage : La prise de decision, les tableaux de bord projet, le reporting. Les differentes revues de projet. La conduite de reunion et le management de l'equipe. / NA"
"96","GE38","MANAGEMENT ET OUTILS D'AIDE À LA CRÉATIVITÉ INDUSTRIELLE ET À L'INNOVATION / KM capitalisation de connaissances veille technologique innovation creativite / Nous abordons dans l'UV la creativite industrielle du point de vue theorique et pratique. Nous mettons en oeuvre des outils d'aide à la creativite dans le cadre des travaux pratiques et d'un projet reel. Nous abordons, comme domaines complementaires : la capitalisation des connaissances, les notions de savoir et savoir-faire, connaissances, competences, le domaine de veille, de l'audit technologique et de la protection industrielle / Outils et methodes de l'ingenieur / Techniques manageriales / L'objectif de l'UV est de former l'etudiant ingenieur a<U+00A0> la gestion des ressources technologiques. L'etudiant devra etre capable de mener a<U+00A0> bien des actions ponctuelles ou sectorielles repondant a<U+00A0> une ou plusieurs partie du domaine de l'UV. Pour cela, il devra conn'aitre des methodes generales d'aide a<U+00A0> la decision et des methodes particulieres liees aux secteurs etudies. / NA / NA / Nous abordons dans le cadre de cette UV : La veille, La creativite, La capitalisation des technologies et du savoir-faire (KM), L'audit des technologies, L'enrichissement du portefeuille technologique, La Brevet et la protection industrielle, / A l'issue de cette formation l'etudiant devra s'etre approprie des methodes, (proposees dans l'UV ou decouvertes pendant le semestre) permettant de resoudre les problematiques liees au domaine de l'UV."
"97","GE39","MANAGEMENT ET MARKETING DE L'INNOVATION / diagnostic de viabilite marketing  strategies et environnement  comportement probable de l'acheteur plan Marketing segmentation prescriptive co-developpement Business Model / Comment reperer et caracteriser dans l'environnement les opportunites nouvelles? Comment evaluer le potentiel d'un projet innovant? Y a t-il un marche? S'inscrit-il dans votre strategie? Quels seraient vos futurs clients? Vous entamerez une demarche à travers un cas reel pour passer de l'analyse de l'environnement à une decision de lancement sur le marche. / Outils et methodes de l'ingenieur / Techniques manageriales / d'elaborer un plan marketing a<U+00A0> 3 ou 5 ans pour un projet innovant dont le potentiel marche n'est pas encore repere. / - comprendre les enjeux de l'innovation pour une organisation - d'identifier les etapes du processus de management de l'innovation - d'interpreter l'emergence d'idees innovantes (ideation) dans un environnement flou - d'analyser l'environnement du projet emergeant et de l'organisation d'accueil du projet innovant (entreprise, association, collectivite) - d'elaborer une matrice de segmentation permettant d'aborder un marche potentiel en tenant compte des specificites des differents publics (seances de creativite) - diagnostiquer la potentialite du projet innovant tant d'un point de vue technologique qu'economique et commercial. - proposer des options d'orientations strategiques marketing (representation du marche, comportement probable de l'acheteur, elaboration du business modele, schema des relations inter-organisationnelles) - reperer et conseiller des co developpeurs adaptes au projet innovant - recommander un go, no go ou go sous-reserve au porteur de projet. / - Travailler en equipe pluridisciplinaire (marketeur et ingenieur) - analyser un environnement instable - faire de la veille technologique et concurrentielle - construire des hypotheses de travail - manager un projet - gerer des relations constructives avec des industriels - rediger une synthese analytique et operationnelle pour le porteur de projet avec des prises de position et des recommandations (sans chercher a<U+00A0> lister l'ensemble des travaux du semestre) / - strategies de l'entreprise : comment l'innovation va t-elle s'integrer avec coherence dans la politique de l'entreprise ? - Marketing de l'innovation : les etapes indispensables pour securiser sa demarche jusqu'au plan Marketing en saisissant les opportunites . - Management global de l'innovation : finances; protections; veille; intelligence economique ; specificites B to B ; plan de developpement ; comportement probable du futur client / - savoir elaborer la demarche globale de management d'un projet innovant - savoir batir un plan marketing strategique elabore (segmentation;diagnostic;plan sur 3 ou 5 ans ; protection de l'innovation ; financement ...) - pouvoir orienter une decision de ""go"" ou ""no go"""
"98","GE40","MANAGEMENT DE PROJETS / projet management planning rentabilite coa<U+00BB>t-budget phase - jalon delai risque tache - livrable innovation / Cette UV de perfectionnement au management des projets permet d'acquerir des competences pour recruter et conduire des equipes projet (cours, exercices theoriques et temoignages de chefs de projet).A l'issue de cette uv, l'etudiant sera capable d'organiser, de piloter un projet industriel complexe en tant que chef de projet. / Outils et methodes de l'ingenieur / Techniques manageriales / etre acteur projet efficace, en tant que representant de sa specialite dans l'equipe, et a<U+00A0> m'aitriser les techniques specifiques de management de grands projets en tant que chef de projet. / - preparer les decisions de lancement ou d'arret des projets: realisation de business plan, d'etude de faisabilite technico-economique, etude de rentabilite, cahier des charges preliminaire; - clarifier les missions, les objectifs, les contrats; - organiser le projet: preparer les plannings, les budgets (evaluer les coa<U+00BB>ts), recruter son equipe et repartir les taches, m'aitriser les delais, les coa<U+00BB>ts et les risques; - m'aitriser les contrats de sous-traitance; - mettre en place le systeme d'information, la gestion des documents et des donnees; - piloter l'action, gerer l'information, motiver et mener l'equipe au succes; - m'aitriser la conception : les verifications, validations et revues de conception, la gestion de configuration; - capitaliser l'experience acquise et organiser le retour d'experience. / NA / ·Rappels : Definitions, enjeux, typologies, les phases d'avant-projet, de definition, de realisation. Methode generale de management de projets. ·Application des principes de management de projets : Approche processus. PDP, structuration du projet. Ingenierie simultanee, cycle en V. Typologie des projets et modes d'organisations pour la gestion d'un projet. Niveaux de responsabilite dans la gestion d'un projet. Les normes de gestion de projet et les referentiels sectoriels de gestion de projet (RGAERO0040, ISO10006, ISO9001, ISOTS16949/QS9000, ') ·Management des risques projet : Analyse Preliminaire des risques (APR), Analyse des Modes de Defaillance et Etude de leur Criticite (AMDEC) Projet, methodes pour les etudes de faisabilite techniques. M'aitrise de la conception : revue de contrat, verification, validation et revues de conception ; Gestion de configuration, m'aitrise des modifications. ·M'aitrise des coa<U+00BB>ts : Faisabilite economique d'un projet, etude d'opportunite. Les fiches prix, les methodes d'estimation des differents coa<U+00BB>ts. Le flux de tresorie. ·M'aitrise des delais, de l'approvisionnement et de la sous-traitance : Methodes de calculs d'avancement. La gestion des achats et des contrats de sous-traitance pour les projets. La gestion des penalites de retard. ·Management par projet : Modeles d'organisation pour le management par projets. Niveaux de responsabilite dans la gestion des projets d'une entreprise. Role des acteurs dans le management par projet. Les logiciels de gestion de projet. Le recrutement et l'evaluation des membres de l'equipe projet. Les logiciels de gestion de projet. Le retour d'experience et la capitalisation. Gestion de la documentation : mise en place d'un systeme d'information, evolution de la documentation, identification et tra<e7>abilite des documents et donnees. Diffusion de l'information, gestion des listes. ·Etudes d'impact, conduite du changement, projets europeens ·Temoignage : la communication dans et autour du projet, les projets dans l'automobile, les projets dans les services,les grands projets aeronautiques et spatiaux, les projets de recherche,les projets bio-medicaux,les projets de BTP, les projets d'informatique. / Les competences que l'etudiant doit acquerir dans cette UV sont, sa capacite a<U+00A0>: ·Preparer les decisions de lancement ou d'arret des projets: realisation de business plan, d'etude de faisabilite technico-economique, etude de rentabilite, cahier des charges preliminaire. ·Clarifier les missions, les objectifs, les contrats. ·Organiser le projet: preparer les plannings, les budgets (evaluer les coa<U+00BB>ts), recruter son equipe et repartir les taches, m'aitriser les delais, les coa<U+00BB>ts et les risques. M'aitriser les contrats de sous-traitance. Mettre en place le systeme d'information, la gestion des documents et des donnees.
 ·Piloter l'action, gerer l'information, motiver et mener l'equipe au succes. M'aitriser la conception : les verifications, validations et revues de conception, la gestion de configuration. ·Capitaliser l'experience acquise et organiser le retour d'experience"
"99","GE90","ORGANISATION, INNOVATION ET INTERNATIONAL / economie de la connaissance science des organisations gestion de l'innovation approche internationale / l'UV consiste à exploiter les travaux du seminaire de l'inter-semestre «Organisations, innovations et international». l'etudiant interroge ainsi des specialistes de sciences economiques et gestion venus debattre de leurs recherches sur des questions contemporaines ouvertes. La participation au seminaire est necessaire pour s'inscrire à cette UV. Ce travail est comparable à une IR. / Sciences economiques et de gestion / Sciences economiques et de gestion / comprendre, a<U+00A0> partir d'une problematique structurant une semaine de seminaire, les grandes transformations technico-economiques qui sous-tendent le renouvellement des pratiques d'ingenierie et les activites au sein de l'organisation. / - identifier les grands enjeux economiques induits par les transformations du capitalisme; - construire un point de vue critique sur les mutations technico-economiques contemporaines; - poser et approfondir une problematique a<U+00A0> partir de contributions et points de vue differents exprimes lors d'un seminaire et de lectures complementaires. / - formaliser dans un rapport ecrit une reflexion sur une problematique technico-economique; - participer activement a<U+00A0> des echanges collectifs autour d'une thematique economique. / Le programme est specifique au theme de l'annee pour le seminaire. Pour exemple, pour l'annee 2002, le programme a ete : Journee 1 - Economie fondee sur la connaissance et nouvelles technologies cognitives : un changement de paradigme socio-technique ?. Journee 2 ( journee commune avec Phiteco) - Les technologies cognitives, l'innovation et l'organisation. Journee 3 - L'entreprise et la centralite de la connaissance dans la production de valeur : quels roles et usages des technologies cognitives ? Le programme de l'UV est organise selon 5 jours de « seminaires » qui se tiennent a<U+00A0> l'UTC fin janvier. La validation de l'UV est donc conditionnee par la presence et la participation effective a<U+00A0> ces 5 journees, ainsi que par la remise d'un rapport final en binome ou trinome, au plus tard a<U+00A0> la fin du semestre concerne. Le 1er temps de l'UV consiste donc en ces 5 journees. Elles se decomposent en 3 journees de seminaires « ouverts » ( la partie « colloque international ») (voir le programme sur www.utc.fr/oi2) encadrees par une « pre-journees » etudiants, et une « post-journee » etudiants. La pre-journee a<U+00A0> pour finalite de vous preparer aux 3 jours du seminaire-colloque, en presence de differents enseignants-chercheurs de l'UTC. La post-journee permet, toujours en presence d'enseignants-chercheurs de l'UTC, de capitaliser sur ce seminaire et de mettre au point un sujet et un binome/trinome pour realiser votre rapport. A la fin de ces 5 jours, vous aurez donc choisi un sujet de rapport ainsi que les textes/interventions du seminaire vous servant de base, prevu une petite etude de terrain, et aurez etabli un binome ou trinome pour le realiser. Le 2eme temps de l'UV GE90 consiste en une revue de l'etat d'avancement du rapport, qui a lieu normalement au milieu du semestre concerne. Cette revue s'effectue separement par binome/trinome. Elle vise a<U+00A0> s'assurer que le travail deja<U+00A0> effectue cadre bien avec l'objectif initial, et de vous guider pour la realisation finale du rapport. Le 3eme temps correspond a<U+00A0> la remise du rapport final. La notation du rapport est effectuee par un des enseignants animateurs de l'UV GE90. / Amener le futur ingenieur, acteur privilegie de la dynamique innovatrice, a<U+00A0> developper sa comprehension des mutations en cours du capitalisme contemporain quant a<U+00A0> l'innovation, a<U+00A0> la mondialisation, et aux nouveaux modes d'organisation des firmes qu'elles induisent, sur un theme specifique chaque annee. Cette UV permet egalement une initiation a<U+00A0> la formation par la recherche."
"100","HE01","ÉPISTÉMOLOGIE ET HISTOIRE DES SCIENCES / intelligence artificielle medicale science moderne relativisme science antique ruptures biologie et biomedecine scientificite  realisme sciences medicales / Etude critique de la dynamique historique des sciences et de ses enjeux methodologiques et philosophiques. Y a-t-il une demarche propre aux pratiques scientifiques ? Comment penser l'origine et les (r)evolutions historiques des sciences, mais aussi les relations entre sciences, techniques et societes ? / Sciences humaines et sociales / Sciences humaines et sociales / Comprendre et d'analyser les principales transformations theoriques, methodologiques, technologiques et culturelles connues par les sciences de la nature de l'Antiquite jusqu'au XXeme siecle, en passant notamment par l'apparition de la science « moderne ». / - Conn'aitre les differentes manieres de lire l'histoire des sciences, au prisme de debats methodologiques comme celui entre internalisme et externalisme, entre presentisme et historicisme, et entre continuisme et discontinuisme. - Comprendre et mobiliser critiquement les apports de l'histoire des sciences et de l'epistemologie lorsqu'il s'agit de definir l'« expertise scientifique », l'« objectivite », la « scientificite », et plus largement les rapports entre sciences, techniques et societe, mais aussi les relations multiformes entre science et ingenierie. - Conn'aitre la portee et les limites de quelques grands courants en philosophie des sciences : positivisme, realisme, instrumentalisme, falsificationnisme, inductivisme. / - Analyser et presenter oralement un texte (article, extrait d'ouvrage,...) relevant de l'histoire des sciences ou de l'epistemologie, en synthetisant et en problematisant ses hypotheses et enjeux principaux ; - Restituer, oralement et par ecrit, les principaux points d'une seance de cours (CR) ; - Conceptualiser, complexifier et problematiser de maniere adequate des faits historiques au prisme de l'histoire des sciences et de l'epistemologie. / Parallelement a<U+00A0> une presentation systematique des grandes epistemologies, on analysera differents moments essentiels de l'histoire des sciences : la science de la scolastique ; l'origine de la science moderne ; la connaissance de l'espace depuis les Grecs jusqu'a<U+00A0> Einstein ; la biologie de l'evolution ; ' Via des exposes on proposera diverses etudes particulieres d'histoire et de sociologie des sciences actuelles ou passees. / Savoir situer les sciences presentes dans une histoire generale toujours en cours. Avoir compris la diversite des disciplines, des methodes et des modes de validation scientifiques et techniques. Conn'aitre le vocabulaire et les notions fondamentales des differentes epistemologies."
"101","HE03","LOGIQUE / Histoire de la logique Systemes axiomatiques Logiques antiques positivisme logique, cercle de Vienne Incompletudes et limitations de la logique / Objectifs de l'UV : enrichir les cultures scientifique et philosophique. Y sont abordees des questions fondamentales, ainsi celle des rapports entre logique et philosophie notamment pour la logique antique et medievale, et entre logique contemporaine et les disciplines connexes que sont les mathematiques et l'informatique. / Sciences humaines et sociales / Sciences humaines et sociales / (1) Un premier objectif est d'enrichir la culture scientifique de l'etudiant en logique. (2) Un deuxieme objectif est d'accroa<U+00AE>tre la culture technique : il s'agit, a<U+00A0> titre d'illustration, et en prenant comme support certains langages de la logique mathematique, de faire decouvrir et appliquer les principes et les mecanismes propres a<U+00A0> ces langages, en particulier dans l'expression et la validation des raisonnements. (3) Un troisieme objectif est de comprendre les enjeux philosophiques de la logique. Pour cela, l'histoire de la logique permet de mesurer combien les innovations techniques sont des consequences directes d'options metaphysiques et philosophiques tranchees et precises. Toute conception scientifique repose sur des choix ideologiques: c'est ce que rappelle et demontre l'histoire de la logique. / - m'aitriser des formalismes pour representer le raisonnement humain; - comprendre les rapports entre les formalismes, et au premier chef ceux de la logique, avec les ""sciences dures"" (mathematiques, physique, informatique); - comprendre la portee et les implications des theoremes de limitation, et la portee des methodes axiomatiques; - mobiliser les principes et les mecanismes propres a<U+00A0> certains langages de la logique mathematique, en particulier pour l'expression et la validation des raisonnements; - comprendre les enjeux philosophiques de la logique. / - faire une bibliographie dans un domaine delimite. / Les points suivants sont abordes : - Formalismes et sciences : qui veut conn'aitre et faire conn'aitre une discipline scientifique en profondeur per<e7>oit la necessite de formaliser. - Histoire de la logique, d'Aristote a<U+00A0> Ga<U+00B6>del : on met en particulier en evidence en quoi l'evolution des connaissances scientifiques a suscite l'evolution de la logique, et en quoi reciproquement celle-ci a profondement influence l'evolution de la science moderne. On insiste notamment sur la periode charniere qui vit l'apparition de la logique mathematique, sous l'action conjuguee de personnages tels que Leibniz, Frege, Russel, Hilbert, .... - Les systemes formels : il s'agit de montrer comment ces systemes fondent la demarche axiomatique, et de revenir sur des notions essentielles comme celles d'adequation, completude ou decidabilite. - La logique des propositions : ce langage peut servir d'assise a<U+00A0> l'expression et a<U+00A0> l'analyse de certains types de raisonnement valide. Differents aspects en sont presentes : syntaxique, semantique et formel. - Quelques elements de logique des predicats : ce langage de la logique mathematique est tout a<U+00A0> fait fondamental. Cette UV en esquisse quelques bases. / L'etudiant devra posseder les competences suivantes a<U+00A0> la fin de l'UV : - une vision globale de l'evolution de la logique de l'antiquite jusqu'a<U+00A0> nos jours, - la comprehension de certains concepts fondamentaux de la logique formelle, - une culture scientifique etoffee sur les fondements des sciences, et en particulier des mathematiques et de l'informatique, - des elements de la logique des propositions (et dans une moindre mesure de la logique des predicats) qui lui permettent de mener des preuves syntaxique et semantique."
"102","HT01","CULTURE ET HISTOIRE DES TECHNIQUES / technologie et societe histoire des techniques histoire de l'innovation technique / L'UV a pour objectif de sensibiliser l'etudiant à la relation technique/technologie/societe, grace aux apports de l'histoire, de la sociologie, de la philosophie et de l'anthropologie : presentation des objets techniques, des principaux moments de l'histoire des techniques, des revolutions industrielles, des lois d'evolution et du fonctionnement de la technologie. / Sciences humaines et sociales / Sciences humaines et sociales / - mobiliser un ensemble de concepts et theories historiques pour decrire, analyser et expliquer les processus techniques et technologiques ; - conduire une recherche bibliographique avec l'outillage propre a<U+00A0> l'historien. / - decrire dans leurs principes generaux certains des processus d'evolution des techniques et technologies ; - enoncer les principes de la demarche de recherche en histoire ; - analyser de fa<e7>on critique un article d'histoire des techniques ; - aborder de maniere critique les discours mediatiques et peu nuances quant a<U+00A0> l'evolution technique des societes humaines. / - realiser une bibliographie sur un theme propre aux sciences humaines ; - realiser l'expose d'un article scientifique ; - s'orienter a minima dans le champ de l'histoire des techniques. / NA / NA"
"103","IA01","INTELLIGENCE ARTIFICIELLE / Intelligence Artificielle Representation des connaissances Raisonnement programmation symbolique Reseau de neurones artificiels Algorithme genetique Logiques de description Ontologie Reseaux semantiques Systeme multi-agents / L'UV permet aux etudiants : (1) de maitriser les notions et techniques de base de l'Intelligence Artificielle, (2) de mettre en oeuvre une programmation symbolique de type fonctionnel. Les notions et techniques seront introduites à partir d'applications developpees au moyen du langage LISP. / Informatique / Intelligence artificielle : apprentissage, representation / modeliser des connaissances et developper des programmes exploitant ces modeles. / - distinguer IA symbolique, IA numerique et IA distribuee. - identifier les notions de base de l'IA. - appliquer les techniques de base de l'IA. - mettre en pratique une programmation symbolique de type fonctionnel. / NA / Introduction a<U+00A0> l'IA, Introduction a<U+00A0> LISP Representation symbolique et langage Lisp Programmation Lisp Systemes de production Notion de S.E. Representation des connaissances Les representations objet Matching/Unification Raisonnement a<U+00A0> partir de cas Sytemes multi-agents L'incertitude dans les systemes de connaissances Algorithmes Genetiques Les Reseaux de Neurones Artificiels / Les etudiants a<U+00A0> la fin du cours devront m'aitriser suffisamment ces techniques pour pouvoir realiser des petits projets mettant en 'uvre quelques-unes des notions presentees dans le cours."
