"","Code","infos"
"250","SI22","SIGNES ET CONTENUS NUMÉRIQUES / Semiotique Communication Langage Support numerique Discours Image Sens Signe / E travers l'analyse d'objets varies (affiches, unes de journaux, emissions televisuelles, films, sites Web politiques), l'UV a pour objectifs de susciter une lecture critique des messages auxquels nous sommes confrontes quotidiennement et de permettre une meilleure apprehension de nos pratiques symboliques. Les modalites de construction du sens et les enjeux du numerique dans ce processus sont au centre des interrogations de l'UV. / Sciences de la communication / Sciences de la communication / mettre en oeuvre une lecture critique des messages auxquels il est confronte quotidiennement (publicite, medias, communication politique et scientifique). / - Comprendre le phenomene d&#8217;elaboration du sens et le role joue par les supports techniques dans ce phenomene (notamment le numerique) ; - Mettre en oeuvre des methodologies d&#8217;interpretation des corpus textuels, iconiques et sonores selon les contextes et les supports techniques (medias, dispositifs numeriques) ; - Synthetiser son analyse et de la formuler correctement (redaction ecrite, expression orale). / - Analyser les situations communicationnelles, - Penser le role de la technique dans les phenomenes de communication, - Mettre en oeuvre une lecture critique des dispositifs numeriques, - Communiquer de maniere adequate a<U+00A0> l&#8217;ecrit et a<U+00A0> l&#8217;oral. / La communication, l'approche structurale, la semiotique, le signe, l'organisation globale du sens, l'analyse du discours, l'image fixe, l'image en mouvement, les nouvelles images, la semiotique des espaces, la semiotique des gestes, la semiotique du son / L'etudiant est initie aux fondements theoriques et aux methodes de la semiotique. Il apprend a<U+00A0> porter un regard critique sur les messages dont il est le recepteur et a<U+00A0> adopter une posture reflexive sur les pratiques symboliques contemporaines (production et reception de discours, d'images et de son, pratique des jeux videos, participation a<U+00A0> des forums en ligne)."
"251","SI24","ÉTUDES DES ÉCRITURES NUMÉRIQUES ORDINAIRES / Ecriture numerique theorie du numerique ecriture collaborative / Courriers electroniques, presentations, redaction collaboratives de documents, etc. : nous pratiquons tous, quotidiennement, l'ecriture numerique. Mais en quoi ces nouveaux dispositifs d'ecriture transforment-ils nos manieres d'ecrire de tous les jours, nos ecritures « ordinaires » ? Nous etudierons (approche theorique) les specificites de l'ecriture numerique afin de porter un regard critique sur nos pratiques d'ecriture quotidiennes. / Sciences de la communication / Sciences de la communication / proceder a<U+00A0> l'analyse techno-semiotique d'un outil d'ecriture numerique et d'utiliser cet outil en ayant conscience de l'influence qu'il est susceptible d'avoir sur ses pratiques communicationnelles dans un contexte personnel ou professionnel. / - expliquer en quoi l'ecriture est une technologie de l'intellect; - expliquer quelles sont les specificites de la technologie numerique et ses consequences pour l'ecriture ; - proceder a<U+00A0> une analyse critique des pratiques d'ecriture numerique dans un outil donne, i.e prendre une distance reflexive s'appuyant sur une comprehension des choix qui ont preside a<U+00A0> la conception de l'outil et mesurant leur influence sur les pratiques. / - adopter une posture critique vis-a<U+00A0>-vis des differents dispositifs communicationnels contemporains en vue de pouvoir y interagir de maniere pertinente, - identifier les enjeux societaux lies a<U+00A0> l'ecriture numerique, - construire une problematique articulant les differents points de vue possibles sur un theme sensible (identite numerique, droits d'auteur, notion de document, archivage numerique, TICE, disparition de l'ecriture cursive, etc.), - participer en argumentant de maniere documentee a<U+00A0> un debat instrumente par des outils d'ecriture numerique en exploitant de maniere pertinente les possibilites de l'outil. - poser un probleme; - argumenter un point de vue; - ecouter d'autres points de vue et de les discuter sur un plan logique et factuel; - formaliser sa pensee de maniere lisible et construite. / Introduction aux specificites de l'ecriture numerique. Histoire de l'ecriture et theorie du support. L'activite scripturale (ou comment ecrit-on?). Les pratiques d'ecritures numeriques actuelles. Le cas specifique de l'ecriture collaborative. La semiotique des ecrits d'ecran. Les enjeux de l'ecriture numerique dans les organisations. Ouvertures : la cartographie numerique, les pratiques creatives. / Au terme de cette UV, vous devriez avoir une comprehension globale de l'impact du numerique sur les pratiques d'ecriture. Cette connaissance devrait vous permettre a<U+00A0> la fois de d'avoir une attitude plus critique par rapport a<U+00A0> vos pratiques d'ecriture quotidiennes mais aussi de vous adapter plus facilement aux evolutions incessantes des outils numeriques."
"252","SI28","ÉCRITURE INTERACTIVE ET MULTIMÉDIA / narration multimedia hypermedia web transmedia smartphone scenarisation interface interactivite design / Recits interactifs, jeux video, art numerique... Dans quelle mesure les caracteristiques du support numerique peuvent-elles generer de nouvelles formes d'ecriture et de scenarisation ? Grace à la prise en main de certains logiciels (notamment Unity, Twine, mais aussi logiciels de graphisme, de son, de video), vous concevrez et realiserez un projet interactif et multimedia en exploitant les specificites du support (PC, smartphone, tablette...). / Sciences de la communication / Sciences de la communication / - concevoir et realiser un projet interactif et multimedia en exploitant les specificites du support. / - reflechir sur les specificites de l'ecriture interactive et multimedia; - conduire un projet multimedia; - m'aitriser des outils de realisation multimedia. / NA / Contenu theorique : - Introduction a<U+00A0> l'ecriture multimedia - La conduite d'un projet multimedia - La structuration du contenu - La navigation - La scenarisation - Le recit interactif - L'interactivite - Les ressources medias - L'action sur l'image - L'action sur le son - Typographie et mise en page sur le web - Le Net art Contenu pratique : - Dreamweaver - Flash - Photoshop / Image Ready - Audacity / - reflexion sur les specificites de l'ecriture interactive et multimedia - conduite d'un projet multimedia - m'aitrise des outils de realisation multimedia"
"253","SI90","HUMANITÉS NUMÉRIQUES ET CONTROVERSES / controverse humanites numeriques innovations technologiques / Savoir analyser une controverse en ligne : utiliser et ameliorer les outils existants (fouille de donnees, ingenierie documentaire), reperer le contexte, les acteurs et la construction du debat (dimension sociale, politique, ethique et symbolique) ; savoir synthetiser ; savoir prendre une decision dans un environnement incertain ; prendre conscience de la non-neutralite des dispositifs d'ecriture numerique et de l'activite langagiere. / Sciences de la communication / Sciences de la communication / analyser une controverse sur le Web / - Comprendre la dimension socialement construite de la science et sa capacite a<U+00A0> interroger le fonctionnement de la democratie ; - Reperer le contexte, les acteurs et la construction du debat (dimension sociale, politique, ethique et symbolique) ; - Utiliser et ameliorer les outils existants pour mener l'enquete sur internet (fouille de donnees, ingenierie documentaire), - Savoir tenir compte de la dimension non-neutre de la technique et des dispositifs d'ecriture. / - Savoir prendre une decision dans un environnement incertain. - Etre familiarise avec des outils techniques et les logiques de fonctionnement du web (culture numerique) - Mettre en oeuvre une lecture critique des dispositifs numeriques. / NA / NA"
"254","SO04","INITIATION AU DROIT / droit droit constitutionnel droit communautaire organisation de la justice preuve contrat responsabilite contrat de travail / l'UV permet de decouvrir la matiere juridique à travers le droit constitutionnel, le droit communautaire ainsi que le droit public et prive (pour ces derniers, par l'etude de l'organisation de la justice, la preuve, les contrats, la responsabilite). / Sciences humaines et sociales / Sciences humaines et sociales / - analyser le droit a<U+00A0> travers les textes, la jurisprudence, les contrats et la responsabilite. / - lire et analyser un arret; - comprendre la problematique a<U+00A0> travers un arret ou dans un cas pratique; - decrire la situation juridique ; - trouver une ou des solutions ; - comprendre le lien entre la loi et l'application faite par les juges. / - identifier les consequences juridiques de l'activite industrielle, economique ou de production ; - differencier la responsabilite civile, penale de l'employeur et du salarie ; - vulgariser les notions de droit a<U+00A0> travers l'activite de l'entreprise. / - Etude du fonctionnement des institutions fran<e7>aise - Etude du fonctionnement des institutions communautaires - Elaboration des normes communautaires - Organisation de la justice - Preuve - Contrat - Responsabilite / Sensibilisation au droit et a<U+00A0> sa complexite, comprehension des mecanismes juridiques et des modes de raisonnement"
"255","SO05","SOCIOLOGIE, ORGANISATIONS ET DYNAMIQUES DES COLLECTIFS / Organisations Sociologie Collectifs fiabilite organisationnelle / Cette UV a pour objectif de familiariser les etudiants à la sociologie des organisations. Seront abordees les organisations au sens large: entreprises, industries à risque, associations et collectifs en reseaux. Objectifs pedagogiques: -Donner aux futurs ingenieurs des outils conceptuels et methodologiques pour reconnaître et analyser des contextes organisationnels contemporains.-S'adapter et participer au changement dans les organisation / Sciences humaines et sociales / Sciences humaines et sociales / mobiliser un regard analytique, comprehensif et critique sur l'organisation et plus generalement sur l'action des collectifs. Plus precisement: Au dela<U+00A0> des theories classiques des organisations, il s'agit dans un premier temps, de mettre au jour les dimensions sociales de l'organisation. E partir du constat, qu'entre l'organisation du travail, et l'individu, il existe un travail social de reorganisation, qui n'est pas porte par l'organisation elle-meme, mais par des collectifs qui depassent ses frontieres, il s'agit de comprendre la dynamique de ces changements. On parlera alors plus generalement du ""collectif"" pour designer le social etendu aux non humains qui le composent. Ainsi, si l'organisation ne se limite pas a<U+00A0> l'entreprise et si on y comprend d'autres acteurs (acteurs institutionnels, des associations, et autres mobilisations collectives) la technique, y tient egalement un role essentiel. En interrogant ces differentes articulations, nous insisterons notamment sur les enjeux du numerique et des TIC, ces derniers a<U+00A0> la fois comme outils organisationnels repandus mais egalement comme supports extensifs de sociabilite. / - donner aux futurs ingenieurs des outils conceptuels et methodologiques pour reconn'aitre et analyser des contextes organisationnels contemporains. - s'approprier des concepts cles en sociologie des organisations. - s'adapter et participer au changement dans les organisations et les collectifs / NA / Qu'est ce que la sociologie? Qu'est ce qu'une organisation? 1. Les theories des organisations et ses critiques. a. Au debut, la division du travail b. Ecole des relations humaines c. L'analyse strategique d. Approches culturalistes des organisations e. Collectifs et identites professionnelles. 2. De l'organisation aux collectifs a. Au-dela<U+00A0> de l'agent/acteur b. Societe du risque, societe reflexive et theorie de la structuration c. Epreuves et justifications de l'action d. La theorie de l'acteur reseaux 3. Sociologie des collectifs contemporains a. Innovation et changements organisationnels b. Sociabilite et dispositifs techniques c. Les communautes de pratique et epistemiques d. Communautes virtuelles et organisations / - Donner aux futurs ingenieurs des outils conceptuels et methodologiques pour reconn'aitre et analyser des contextes organisationnels contemporains. - S'approprier des concepts cles en sociologie des organisations. - S'adapter et participer au changement dans les organisations et les collectifs"
"256","SO06","ORGANISATION DES SYSTÈMES DE SANTÉ / organismes regulateurs progres technologiques en sante gestion des risques produits, personnels et etablissements de sante / Malgre la diversite des situations economiques ou des traditions administratives, les pouvoirs publics ont mis en place des organisations des systemes de sante avec de nombreux points communs: organes regulateurs, systemes normatifs, assurances maladie, gestion des hôpitaux...C'est un exemple concret de gestion d'un systeme complexe. Voir la rubrique ""details supplementaires"". / Sciences economiques et de gestion / Sciences economiques et de gestion / decrire et comprendre globalement le fonctionnement d'un systeme de sante (structure, elements et relation) et le role joue par chaque acteur (etat, assurance maladie, professionnels et etablissements de sante, patients) / - s'approprier des connaissances generales sur la sante et la medecine utilisables dans sa vie de citoyen - decrire les differents acteurs d'un systeme de sante et leur relation - comparer les differents systemes de sante existant en Europe (bismarkien, beveridgien, liberal) - analyser les points forts (acces aux soins, liberte de choix, assurance maladie, etc) et les points faibles de notre systeme de sante (desertification medicale, desequilibre budgetaire, etc) - prendre position sur des problematiques liees a<U+00A0> la sante (bioethique, telemedecine, CMU, etc) / - travailler en groupe et de restituer un travail collectif a<U+00A0> l'oral par le biais d'activites pedagogiques en travaux diriges - gerer un projet collectif sur un theme lie a<U+00A0> la sante: retro-planning, prise de contact avec des professionnels, redaction d'un rapport - prendre la parole en public par le biais de soutenance orale du projet - ameliorer sa capacite redactionnelle - developper son esprit critique de citoyen en analysant des problematiques de societe liees a<U+00A0> la sante / Les acteurs des systemes de sante Les etats et les organismes de regulation La securite sociale et les assurances maladies Les personnels de sante Les industries La reglementation et l'organisation des soins Lois, normes, certifications Parcours de soins Telemedecine La recherche et l'innovation en sante Comparaisons internationales / une perception de la complexite de ce systeme et le vocabulaire utilise ..."
"257","SO07","DIGITAL POLICIES AND INTERNET REGULATION / NA / Can we govern technology and how? By bringing together different disciplines (political science, law, and economics), this course explores the technical and social arrangements that shape the organization and transformation of content and practices on the web. It adopts a thematic and historical perspective, which aims to discuss specific issues, but above all to grasp the evolution and ruptures that mark the the regulation of the Internet. / Sciences economiques et de gestion / Sciences economiques et de gestion / NA / NA / NA / NA / NA"
"258","SP01","UN CORPS POUR COMPRENDRE ET APPRENDRE / sport physiologie anatomie pedagogie biomecanique apprentissage technologie projet entrainement collectif / Cette UV s'appuie sur la pratique sportive. Elle permet de comprendre le fonctionnement de son corps sur les plans de la physiologie, de l'anatomie, des mecanismes d'apprentissage. Elle renseigne sur l'organisation du sport en France. Une sensibilisation est apportee aux technologies dedies à l'entrainement sportif. Cette UV est inscrite dans le Mineur ""Sport et Technologie"". / Sciences humaines et sociales / Sciences humaines et sociales / mieux conn'aitre son corps, le respecter et le garder en forme. Une sensibilisation est apportee aux technologies dedies a<U+00A0> l'entrainement sportif. / - etablir un lien entre les bases physiologiques et leurs fonctionnements dans les pratiques sportives. - elaborer des charges d'entr'ainement (intensite, duree, forme) en connaissant les reponses physiologiques qu'elles occasionnent sur le plan metabolique, cardiorespiratoire et musculaire. / - construire et conduite un projet (methode et coherence) - acquerir des savoirs, savoir-faire et de savoir-etre transferables dans la vie personnelle et professionnelle. / Un module theorique de physiologie liee a l'effort avec mise en application sur le terrain. Un module theorique de decouverte des bases de l'anatomie humaine oriente vers la charpente squelettique et les grands groupes musculaires. Un module theorique et pratique oriente vers les sciences humaines (principes de la pedagogie sportive, les processus d'apprentissage moteur). Un module theorique sur l'organisation du sport en France (Loi sur le sport, l'association, la responsabilite des dirigeants). / Sensibilisation au fait qu'une pratique sportive bien menee ne s'improvise pas, qu'elle s'appuie sur des bases scientifiques averees qui induisent methode et coherence dans la construction et la conduite d'un entr'ainement et d'une competition. Sensibilisation au fait que le sport est un champ privilegie de sociabilite et que la pratique sportive, dans toutes ses composantes, contient une grande quantite de savoirs, savoir-faire et de savoir-etre transferables dans la vie personnelle et professionnelle."
"259","SP02","CONDUIRE UN PROJET SPORTIF / experience concrete vecu activite sportive projet pedagogique conduite d'un groupe responsabilite / encadrement reel d'une activite sportive ou d'un projet sportif ou realisation d'un projet sportif personnel. / Sciences humaines et sociales / Sciences humaines et sociales / - la conduite d'un groupe - la gestion et organisation d'une seance sportive - la transmission de savoir et de savoir faire - Prise en compte des contraintes de chacun et du groupe - l'adaptation et la creativite / - Elaborer des seances d'entr'ainement adaptees et variees - Communiquer de fa<e7>on appropriee et claire - Atteindre un ou plusieurs objectifs - Gerer des contraintes (liees a<U+00A0> l'evolution d'un groupe ou d'une situation) - Developper des competences dans son domaine d'activite sportive ou dans la gestion de projet : m'aitrise des techniques d'entr'ainement, axes de travail, ... - Developper une approche pedagogique dans l'encadrement de son activite / - Instaurer et appliquer des regles : se conduire dans le groupe, ecouter et respecter les autres, cooperer... - S'adapter et creer en fonction des problematiques rencontrees ou des objectifs vises - Se responsabiliser avec un projet qui lui appartient (respect des contraintes horaires, ...) - M'aitriser la securite liee a<U+00A0> une activite ou a<U+00A0> un projet / l'etudiant desireux de vivre une experience concrete peut choisir: - de gerer un evenement sportif: Raid sportif, competition, tournoi, etc... - d'encadrer une activite sportive (a<U+00A0> l'UTC ou dans un club local) - de planifier et d'analyser sa saison sportive (reserve aux etudiants sportifs participant au minimum a<U+00A0> des competitions de niveau interregional) Pour etre significative l'experience s'etend sur deux semestres qui en regle generale, correspondent a<U+00A0> une saison sportive. / Que le projet contractualise avec les enseignants de sport soit mene concretement a<U+00A0> son terme et analyse au travers d'un travail ecrit et presente oralement."
"260","SP11","ADAPTATION BIOLOGIQUE À L'EXERCICE PHYSIQUE / NA / Cette UV a pour objectif d'explorer les processus de l'adaptation biologique à l'exercice physique. Cette adaptation est faite tout le long de la vie depuis la phase de croissance lors de la maturite puis en senescence. Celle-ci comprend les adaptations liees à une pathologie (diabete, obesite, ...) mais aussi celles liees à un environnement(chaleur, altitude, microgravite) / Sciences humaines et sociales / Sciences humaines et sociales / A l'issue de l'enseignement, l'etudiant sera capable d'avoir : - une connaissance generique sur les themes : - Sources d'energie de l'exercice musculaire - Nutrition du sujet sain - Controle nerveux de la contraction musculaire - Plasticite du systeme neuro-musculo-squelettique - Biologie de l'adaptation - Composition corporelle - Energie et Puissance - Connaissance specifique sur les themes : - Les methodes d'evaluation de la performance et de l'activite physique - Influence de l'age et de l'environnement - Effets prophylactiques et therapeutiques de l'exercice physique - Nutrition du sportif - Composition corporelle pour la performance sportive - Modele energetique - Ergometrie / A l'issue de l'enseignement, l'etudiant sera capable d': - utiliser des outils mathematiques, statistiques et de physique appliquee aux domaines biotechnologiques et biomedicaux (C2) - analyser des processus complexes dans la resolution de problemes et la conception de bioproduits et d'equipements (C3) - effectuer un choix de materiaux ou d'equipements pour l'optimisation d'un procede d'analyse (C4) / NA / Sources d'energie dans l'exercice musculaire ; Controle nerveux de la contraction musculaire ; Adaptations cardio-vasculaire et respiratoire a<U+00A0> l'effort ; Mecanique musculaire ; Endocrinologie et exercice musculaire ; Strategie alimentaire du sportif. Ces cours de base sont completes par des conferences donnees par des specialistes du terrain (planification d'un entr'ainement, activite physique en milieu extreme ....) et des travaux pratiques permettant de quantifier les effets d'un entr'ainement suivi par l'etudiant (endurance, pliometrie, ...). / Prise de conscience des regulations physiologiques impliquees dans l'adaptation a<U+00A0> l'exercice et acquisition de connaissances de base. Identification des possibilites d'application dans la pratique personnelle d'une activite physique."
