"","Code","infos"
"177","MQ02","MÉCANIQUE DES SOLIDES DÉFORMABLES / tenseur des contraintes equilibre cinematique des solides deformables criteres limites lois de comportement / l'UV donne une initiation à la mecanique des milieux continus solides. On y aborde les notions necessaires à la resolution des problemes d'elasticite ainsi que les principes de l'energie qui sont à la base des methodes numeriques utilisees dans le domaine, telles que la methode des elements finis. / Mecanique des solides et des structures / Resistance des materiaux/calcul des structures / Comprendre les notions de base de la mecanique des solides deformables en vue de pre dimensionner / dimensionner des composants et des systemes mecaniques. / - definir le tenseur de contraintes et les equations d'equilibre pour un solide deformable; - etablir des criteres limites en contraintes (plasticite, fatigue, etc.); - aborder la cinematique des milieux deformables et etablir les tenseurs de deformations; - comprendre la notion de lois de comportement et generaliser la loi de Hooke aux etats de contraintes quelconques; - comprendre les theoremes et principes de l'energie et les appliquer a<U+00A0> l'analyse de structures (calcul approche). / - Situer les limites de la RDM - Dimensionner des composants mecaniques de formes complexes - Comprendre les differents criteres de dimensionnement (chargement statique, fatigue...) / 1. Flambement des poutres - Generalisation de la notion de charge critique de flambement au-dela<U+00A0> de la colonne d'Euler 2. Tenseur des contraintes et equation d'equilibre - Notion d'effort interne dans un milieu continu - Etablir le tenseur de contraintes - Ecrire les equations d'equilibre en un point 3. Criteres limites en contraintes - Criteres independants de la contrainte hydrostatique pour la plasticite (Tresca et von Mises) - Critere de rupture pour les materiaux fragiles (Mohr) - Criteres dependants de la contrainte hydrostatique (Mohr-Coulomb) - Criteres de fatigue 4. Cinematique des corps deformables - Definition du tenseur gradient de deformations - Etablissement de differentes mesures de deformations - Hypothese des Petites Perturbations 5. Lois de comportement - Generalites sur les differents types de comportement (elasticite, plasticite, dependance a<U+00A0> la vitesse de deformations, dependance au temps') - Lois de Hooke generalisee - Etat de contraintes planes , etat de deformations planes - Energie de deformation 6. Theoremes et principes de l'energie - Principe des travaux virtuels - Principe du minimum de l'energie potentielle totale - Theoreme de Castigliano - Notions de calcul approche / - Generaliser les connaissances de RDM, limitees aux poutres, pour traiter des problemes tridimensionnels - Acquerir les notions de contraintes et de deformations dans un milieu continu - Etre capable de resoudre des problemes d'elasticite dans un cas general - Acquerir les notions de base utilisees en modelisation numerique en mecanique"
"178","MQ03","MÉCANIQUE DES VIBRATIONS - I / mode propre reponse transitoire reponse harmonique frequence propre oscillateur harmonique systemes discrets vibrations / Cette UV donne les bases necessaires à l'analyse, au calcul et à la comprehension des phenomenes vibratoires des systemes discrets, lineaires, à 1 ou plusieurs degres de liberte, avec ou sans amortissement. / Mecanique des solides et des structures / Vibration des structures / NA / - etablir et resoudre l'equation d'un oscillateur harmonique a<U+00A0> 1 ddl (degre de liberte), amorti ou non, libre, ou soumis a<U+00A0> une excitation sinusoa<U+00AF>dale, ou soumis a<U+00A0> des conditions initiales non nulles; - etablir le systeme d'equations d'un oscillateur harmonique a<U+00A0> n ddl, par une approche en effort, ou avec les equations de Lagrange; - calculer les frequences propres et les modes propres d'un systeme a<U+00A0> n ddl; - resoudre des equations de mouvement des systemes a<U+00A0> n ddl libres, ou soumis a<U+00A0> une excitation sinusoa<U+00AF>dale (force ou mouvement imposes), ou soumis a<U+00A0> des conditions initiales non nulles; - calculer la reponse d'un systeme n DDL par une methode de superposition modale. / NA / Partie I : systemes a<U+00A0> 1 ddl - mise en equations (Principe Fondamental, approche energetique) - reponse en oscillations libres, sans ou avec amortissement - reponse en oscillations forcees (excitation harmonique), sans et avec amortissement Partie II : systemes a<U+00A0> n ddl - mise en equations, mise en forme matricielle (equations de Lagrange) - calcul des pulsations propres et des modes propres (sans amortissement) - calcul de reponse a<U+00A0> une excitation harmonique par approche directe, et par decomposition modale / - Ecrire l'equation du mouvement vibratoire d'un systeme discret a<U+00A0> 1 DDL - Trouver la solution de cette equation dans le cas d'une excitation harmonique - Ecrire l'equation du mouvement vibratoire d'un systeme discret a<U+00A0> n DDL - Trouver la solution directe de ce systeme equation dans le cas d'une excitation harmonique - Conn'aitre la notion de frequences propres et de modes propres - Trouver la solution par superposition modale de ce systeme d'equations dans le cas d'une excitation harmonique"
"179","MQ04","POLYMÈRES / thermoplastiques amorphes et semi-cristallins thermodurcissables elastomeres comportement viscoelastique comportement caoutchoutique modelisation et rheologie endommagement et rupture mise en oeuvre / l'UV presente les elements essentiels pour la connaissance des polymeres et de leurs proprietes specifiques en vue de l'utilisation de ces materiaux dans un secteur d'activites donne. / Materiaux / Polymeres / choisir pour une application donnee le materiau polymeres approprie. / - connaitre les divers polymeres (thermoplastiques, thermodurcissables, elastomeres); - connaitre le comportement des polymeres (elastique, viscoelastique, viscoplastique, caoutchoutique) et de leur limite d'utilisation (endommagement, rupture); - m'aitriser l'equivalence temps-temperature; - modeliser les lois de comportement; - lire les fiches techniques (relation mise en oeuvre-proprietes). / NA / Structure des polymeres : polymeres amorphes et semi-cristallins Proprietes physiques : proprietes dielectriques, thermiques et optiques Proprietes mecaniques : comportement caoutchoutique, viscoelastique, viscoplastique, comportement en fatigue Endommagement et rupture des polymeres Caracterisation mecanique et normalisation: traction, choc, fluage, relaxation, fatigue Mise en 'uvre des polymeres et des plastiques Une conference effectuee par un industriel donne aux etudiants une illustration pratique du cours. Les etudiants doivent realiser un mini-projet dans le domaine de leur specialite (mecanique, design, biomedical) leur permettant de concretiser l'ensemble du cours. Les travaux pratiques portent sur la mise en oeuvre (injection et simulation sur ordinateur du moulage d'un objet: logiciel SIM.IN), les essais mecaniques (traction, choc charpy, torsion) et l'identification. / Connaissance des divers polymeres (thermoplastiques, thermodurcissables, elastomeres) Connaissance de leur comportement (elastique, viscoelastique, viscoplastique, caoutchoutique) et de leur limite d'utilisation (endommagement, rupture) M'aitriser l'equivalence temps-temperature Modeliser les lois de comportement Savoir lire les fiches techniques (relation mise en 'uvre-proprietes)"
"180","MQ05","TRIBOLOGIE / frottement usure traitements de surfaces mecanique de surfaces revetements choix des materiaux en tribologie lubrification / Tribologie est une science qui s'interesse aux frottements, usure et lubrification des organes mecaniques en contact. L'UV MQ05 concerne l'enseignement des problemes lies aux actions de contact entre solides en mouvement relatif en vue d'un choix rationnel des solutions conduisant à reduire la consommation d'energie et augmenter la duree de vie et la fiabilite des systemes mecaniques. / Mecanique appliquee / Tribologie / - Expertiser des problemes d'usure, de frottement et de lubrification des differents composants mecaniques en contact en tenant en compte le choix de materiaux, de surface et les conditions de sollicitation. - a<U+008A>tre en mesure de proposer des solutions pour reduire la consommation d'energie et augmenter la duree de vie et la fiabilite des composants mecaniques. / - Utiliser les applications de la tribologie dans l'industrie: energie, transports, usinage, medical,...pour reduire la consommation d'energie et augmenter la fiabilite et la duree de vie des systemes mecaniques. - Analyser le frottement et l'usure des systemes mecaniques et proposer des materiaux, des revetements et des lubrifiants adaptes pour minimiser le frottement et l'usure dans les systemes mecaniques. - Identifier et analyser les differents regimes de la lubrification des contacts et proposer des solutions pour ameliorer les performances tribologiques des surfaces en contact / NA / Frottement,lois d'usure des metaux, polymeres, ceramiques et composites. Mecanique du contact: pression de Hertz, contraintes residuelles, contraintes sous couche. Materiaux en tribologie. Protection des surfaces : revetements et traitement de surfaces. Phenomenes thermiques generes par le frottement. Caracterisation topographique et mecanique des surfaces Analyse des systemes tribologiques. Lubrification: - nature et proprietes mecaniques des lubrifiants - equation generale du film d'huile, guidage hydrostatiques, hydrodynamiques et elastohydrodynamiques, paliers poreux / M'aitrise des problemes d'usure, de frottement et de lubrification, Prise en compte des aspects de frottement depuis la conception mecanique, Optimisation du choix de couples de materiaux et des lubrifiants"
"181","MQ06","MODÉLISATION DES STRUCTURES PAR ÉLÉMENTS FINIS / elements finis coques plaques poutres barres solides statique vibratoire / la methode des elements finis est presentee pour le calcul lineaire des structures, en regime statique et vibratoire. Les structures constituees de barres, poutres, plaques, coques, et solides sont etudiees. La qualite des modeles elements finis, pour le traitement des problemes industriels, est traitee. Un logiciel elements finis de reference est utilise dans le cadre des travaux pratiques et du mini-projet. / Modelisation et simulation / Modelisation et simulation par ordinateur / - conn'aitre les fondements de la methode des elements finis et la formulation de quelques elements simples; - developper une analyse critique sur un modele elements finis et sur les resultats obtenus; - traiter un probleme academique ou industriel avec un logiciel elements finis de reference, dans le domaine lineaire statique ou vibratoire. / - presenter les fondements de la methode des elements finis et la formulation de quelques elements simples, en rappelant les hypotheses et les equations des modeles continus associes; - presenter les principaux types de modeles elements finis developpes et utilises en milieu industriel; - initier a<U+00A0> l'utilisation d'un logiciel elements finis reconnu en milieu industriel; - sensibiliser les etudiants aux difficultes liees a<U+00A0> l'exploitation des modeles numeriques pour les problemes industriels; / NA / NA / - conn'aitre les fondements de la methode des elements finis et la formulation de quelques elements simples - etre capable de developper une analyse critique sur un modele elements finis et sur les resultats obtenus - pouvoir traiter un probleme academique ou industriel avec un logiciel elements finis de reference, dans le domaine lineaire statique ou vibratoire"
"182","MQ07","MATÉRIAUX POUR APPLICATIONS HAUTES TEMPÉRATURES / deterioration durabilite corrosion haute temperature fissuration materiaux traitements de surface revetements / L'UV aborde les materiaux metalliques et composites classiquement utilises dans les domaines de l'energie et des transports, lorsque les conditions d'emploi atteignent des temperatures suffisamment elevees pour activer des modes de degradation specifiques (centrales nucleaires, UVED, turbines terrestres, centrales à gaz ou à charbon, reacteurs d'avions, moteurs thermiques, ...). / Materiaux / Materiaux metalliques, alliages, ferreux, non ferreux / A l'issue de l'enseignement, l'etudiant sera capable de connaitre les principes de base des mecanismes specifiques a<U+00A0> la degradation des materiaux metalliques et ceramiques a<U+00A0> haute temperature. Il fera le lien entre ces mecanismes et le choix des materiaux employes dans ce type de condition, d'une part, mais egalement avec le choix de revetements (et procedes associes) classiquement employes au niveau industriel pour la protection des materiaux a<U+00A0> haute temperature, d'autre part. Il pourra ainsi posseder les connaissances de base pour considerer la specificite de la haute temperature dans les processus de conception, mais egalement quelques competences pour etablir des estimations de duree de vie dans des conditions d'emploi extremes. / - prendre en compte les risques de degradation des la conception d'un montage ou d'une installation utilisee a<U+00A0> haute temperature ; - aborder une etude de cas sur la degradation d'un materiau utilise a<U+00A0> haute temperature ; - lister les causes possibles et les causes probables de la degradation a<U+00A0> haute temperature ; - rechercher les parametres influents sur la duree de vie du materiau utilise a<U+00A0> haute temperature, et estimer cette duree de vie ; - pratiquer d'eventuelles observations et mesures complementaires aux donnees disponibles ; - decrire le mode de degradation, proposer des remedes (en terme de choix de materiau et/ou de revetement) ; - mettre en oeuvre et exploiter des mesures de vitesse de degradation en temperature, et en tirer les renseignements utiles. / - definir un protocole d'etude a<U+00A0> partir d'une problematique donnee - realiser une veille des connaissances sur une problematique definie - apprecier les resultats des techniques de caracterisation usuelles des materiaux - aborder les compromis coa<U+00BB>t / duree de vie / performance des materiaux / NA / NA"
"183","MQ08","ÉLABORATION ET PROPRIÉTÉS D'USAGE DES MÉTAUX / cristallographie dislocations diagrammes de phase traitement thermique acier aluminium aeronautique et automobile Corrosion / L'UV MQ08 aborde les alliages metalliques sous l'angle de leur microstructure en s'interessant à l'effet de la thermique des procedes d'elaboration ou de mise en forme sur la microstructure (fonderie, fabrication additive, ...), le recours aux traitements thermiques, et l'impact de la microstructure sur les proprietes mecaniques usuelles. Par ailleurs, la degradation des alliages metalliques par corrosion est egalement abordee dans l'UV. / Materiaux / Materiaux metalliques, alliages, ferreux, non ferreux / A l'issue de l'enseignement, l'etudiant sera capable d'identifier les elements de la microstructure des alliages metalliques, et l'impact de ces elements de microstructure sur les proprietes mecaniques de l'alliage (essentiellement durete et resistance mecanique). L'etudiant sera egalement en mesure de comprendre comment les procedes d'obtention des alliages definissent leur microstructure. Par ailleurs, l'etudiant possedera une base de connaissance des traitements thermiques industriels applicables aux alliages, et sera capable de realiser des choix de traitement en fonction des objectifs cibles. Il possedera egalement les bases minimales sur la corrosion des alliages metalliques en milieu aqueux afin d'etoffer son panel de connaissances en vue de realiser des choix de materiaux eclaires dans les processus de conception, mais egalement d'envisager des etudes de duree de vie tenant compte de la degradation par l'environnement. / - d'identifier une corrosion sur un alliage metallique par sa nature et d'en deduire son degre de nocivite - de proposer un mode de protection de l'alliage en fonction de la nature du phenomene de corrosion et en realisant un compromis coa<U+00BB>t / performance - de proposer un traitement thermique adapte a<U+00A0> un alliage metallique en fonction des objectifs recherches - d'anticiper le recours a<U+00A0> un traitement thermique sur un alliage en fonction du mode d'elaboration de cet alliage - de piloter les parametres du mode d'elaboration (dans la mesure des possibilites offertes par le mode d'elaboration) afin d'optimiser les proprietes cibles, en se basant sur les relations procede/microstructure/proprietes / - comprendre les mecanismes de durcissement des alliages metalliques - comprendre l'impact des procedes d'obtention et de mise en forme sur les proprietes des alliages metalliques - apprehender les problematiques specifiques aux procedes d'assemblage des alliages metalliques - estimer les risques de degradation des materiaux metalliques par l'environnement / NA / NA"
"184","MQ09","VIBRATIONS DES SYSTÈMES CONTINUS / Structure Vibration Systeme continu Dimensionnement vibratoire / MQ09 presente les methodes de dimensionnement et d'analyse vibratoires des systemes continus : 1D (corde, poutre), 2D (membrane, plaque, coque, structure composite). La presentation des modes des structures academiques, leur couplage et la reponse à differents types de sollicitations (impact, machine tournante, turbulence) est completee par l'introduction à l'analyse modale experimentale et à la fatigue vibratoire. / Mecanique des solides et des structures / Vibration des structures / A l&#8217;issue de la formation, l&#8217;etudiant sera capable d&#8217;analyser le comportement vibratoire d&#8217;une structure pour son dimensionnement. / &#8226; Decrire les familles de mode vibratoire des systemes continus 1D (corde, barre, poutre, tuyau sonore) et 2D (membrane, plaque, coque) et 3D (cavite acoustique) &#8226; Exprimer les equations de Lagrange d&#8217;un milieu continu &#8226; Calculer les frequences et deformees modales de systemes 1D, 2D et 3D &#8226; Ecrire la reponse modale d&#8217;un systeme continu libre et force &#8226; Analyser la reponse modale d&#8217;un systeme continu libre et force &#8226; Mettre en oeuvre les outils d&#8217;analyse modale experimentale d&#8217;une structure / &#8226; Programmer des expressions mathematiques a<U+00A0> l&#8217;aide d&#8217;un logiciel de calcul scientifique (Matlab, Scilab) &#8226; Conduire un projet sur plusieurs seances &#8226; Presenter le resultat d&#8217;un projet &#8226; Appliquer une methode de calcul decrite dans un article scientifique &#8226; Mettre en oeuvre une methode experimentale / Programme des cours C1 Introduction + rappel systemes 1 et 2 ddl C2 Corde + solution a<U+00A0> variables separees C3 Principe de Hamilton - Lagrange continu C4 Barre, cisaillement, torsion, poutre flexion C5 Corde, membranes rectangulaire et circulaire C6 Plaque, coque cylindrique C7 Structures periodiques, composites C8 Caracterisation des materiaux, viscoelasticite C9 Reponse forcee, troncature modale C10 Fatigue vibratoire, controle actif vibratoire C11 Analyse modale experimentale C12 Couplage modal C13 Excitations aleatoires C14 Conference sur le dimensionnement Programme des TD TD1 Systeme a<U+00A0> 2 ddl (Matlab) TD2 Systeme a<U+00A0> N ddl amorti et reponse forcee harmonique (Matlab) TD3 Reponse libre de corde TD4 Barre avec CL mixtes TD5 Vibrations de torsion TD6 Poutre en flexion TD7 Membranes TD8 Plaques et Coques TD9 Reponse d'une structure (Matlab) TD10 Analyse experimentale de poutre (impact) TD11 Analyse experimentale de corde (reponse libre) TD12 Analyse experimentale de plaque (reponse forcee) TD13 Evaluation des seances de projet (TD9-12) / Une bonne comprehension de l'approche modale en vibrations des structures pour leur dimensionnement."
"185","MQ10","COMPORTEMENT MÉCANIQUE DES MATÉRIAUX / lois de comportement fatigue criteres de plasticite endommagement et rupture tenue en service et duree de vie fluage microstructure alliages metalliques / Les proprietes mecaniques des materiaux metalliques sont expliquees en relation avec leur microstructure, afin de donner des lois de comportement applicables au calcul des structures, et de degager des concepts deterministes utiles pour le contrôle-qualite et la durabilite des structures. / Materiaux / Proprietes et lois de comportement / Relier la microstructure au comportement mecanique et aux processus d&#8217;endommagement et de rupture, afin d&#8217;utiliser les materiaux (en particulier metalliques) dans des conditions optimales et securitaires. / - Analyser l&#8217;etat mecanique d&#8217;un materiau en termes de contraintes et deformations mutiaxiales. - Mettre en oeuvre des lois elastiques multiaxiales. - Comprendre le role des defauts microstructuraux dans les processus de plasticite. - Mettre en oeuvre des criteres de plasticite multiaxiale, prevoir les directions d&#8217;ecoulement plastique sous une contrainte donnee. - Evaluer l&#8217;importance des mecanismes de deformation sensibles a<U+00A0> la vitesse, mettre en oeuvre des modeles simples de deformation viscoelastique et viscoplastique sous chargement multiaxiaux. - Comprendre les mecanismes d&#8217;endommagement des materiaux ductiles et fragiles. Mettre en oeuvre des modeles d&#8217;endommagement simples. Utiliser les theories statistiques de l&#8217;endommagement fragile. - M'aitriser les bases de la mecanique lineaire elastique de la rupture, conn'aitre les limites de celle-ci et conn'aitre l&#8217;existence d&#8217;autres types de mecanique de la rupture. - Identifier les mecanismes d&#8217;endommagement et de fissuration afin de preconiser des actions correctrices. - Evaluer la duree de vie d&#8217;une structure soumise a<U+00A0> des chargements cycliques, appliquer la loi de Paris, prendre en compte le rapport de charge, utiliser des lois cumul d&#8217;endommagement tout en etant conscient des limites de ces approches simplifiees. - Determiner les differents effets influen<e7>ant la duree de vie en fatigue, notamment les concentrations de contraintes, les types de chargement, la rugosite, etc&#8230; / - Developper une approche experimentale en utilisant les dispositifs appropries et en tenant compte des normes. - Rediger des comptes-rendus d&#8217;essais en synthetisant le travail de plusieurs groupes. - Analyser la bibliographie afin d&#8217;interpreter des resultats. / Rappels d'elasticite Plasticite microscopique Plasticite macroscopique, criteres de plasticite Endommagement Rupture ductile et rupture fragile Fatigue Fluage et relaxation Modelisation phenomenologique et lois de comportement Approches multiechelles / L'etudiant doit etre capable en fin de semestre de prevoir la duree de vie des structures sous sollicitations monotone et cyclique couplees avec la microstructure et eventuellement l'effet de la temperature. Il doit aussi etre en mesure d'apprehender les fichiers materiaux des modelisations phenomenologiques utilisees dans l'industrie d'un point de vue critique et physique."
"186","MQ11","MISE EN ŒUVRE DES MATÉRIAUX / Composites Polymeres Pseudoplasticite Metaux Viscoelasticite Ecrouissage Mise en forme/oeuvre Fabrication Additive Etat poudreux/liquide/semi-liquide/solide / L'objectif de l'UV est d'apporter aux etudiants les connaissances de base sur les principaux procedes et les nouvelles technologies utilises dans la mise en forme/oeuvre des differentes familles de materiaux (polymeres, composites et metalliques), avec un apercu sur leurs techniques d'assemblage et leurs fonctionnalisations. / Materiaux / Elaboration et mise en forme des materiaux : metalliques, polymere et composites / Comprendre le comportement specifique des types de materiaux et de selectionner le materiau adequat et le procede de mise en oeuvre pertinent en vue de la fabrication de structures ayant une resistance mecanique et une durabilite optimale. / - acquerir des connaissances generales sur les proprietes des materiaux polymeres, composites et metalliques (nature, specificites, applications industrielles...); - acquerir des connaissances sur les fibres, les resines et leur association; - acquerir des connaissances en comportement mecanique, en caracterisation et en mode d'endommagement; - acquerir des connaissances sur les differents procedes de transformation; - identifier le process adequat en rapport avec le materiau selectionne, ses constituants et la structure a<U+00A0> fabriquer. / - comprendre les proprietes mecaniques des materiaux en relation avec leur microstructure; - resoudre les problemes lies a<U+00A0> l'emploi et a<U+00A0> la mise en oeuvre des materiaux industriels. - concevoir la structure reelle en repondant a<U+00A0> un etat de chargement mecanique. / 1 Les materiaux metalliques: 1.1 Mise en oeuvre a<U+00A0> partir de l'etat liquide: solidification(germination et croissance, surfusion...);structure de la piece coulee(zone equiaxe, segregation,defauts de coulee);frittage et soudage 1.2 Mise en oeuvre par deformation plastique: Laminage, forgeage, emboutissage. Lois de la plasticite. Methodes theriques pour la mise en forme; methodes experimentales; Aspect metallurgique. 2. Les materiaux plastiques/ 2.1 Processus de mise en forme:viscoplasticite, instabilite des ecoulements viscoelastique, influence de la masse molaire, de la pression, de la temperature... 2.2 Ecoulement du polymere fondu; 2.3 Extrusion; 3. Les materiaux composites: 3.1 Interet et utilisations industrielles 3.2 Structures et composants: fibres (verre, carbone, aramide); resines (thermodurcissables, thermoplastiques) 3.3 Mise en oeuvre par moulage: au contact, sous vide, par injection. Mise en ouvre par injection et compression: RTM,SMC, BMC ... / Paragraphe 1.1... Conn'aitre les differentes phases de transformation de la matiere(liquide et solide)pour l'btention d'une piece ou d'une structure.savoir les parametres influents sur la mise en oeuvre, les consequences sur leur resistance et leur durabilite."
